<?xml version="1.0" encoding="utf-8"?>
<sm:blocks xmlns:sm="http://example.com/SimulinkModel" xmlns:xsi="http://www.w3.org/2001/XMLSchema-instance" name="out_double_UnitDelay" xsi:schemaLocation="http://example.com/SimulinkModel SimulinkModel.xsd">
   <block blocktype="Inport" name="out_double_UnitDelay_In1" rate="-1">
      <output line="out_double_UnitDelay_In1_1" port="out_double_UnitDelay_In1_1" usename="true">
         <connect block="out_double_UnitDelay_Gain" port="out_double_UnitDelay_Gain_1"/>
         <connect block="out_double_UnitDelay_Gain1" port="out_double_UnitDelay_Gain1_1"/>
         <connect block="out_double_UnitDelay_Gain3" port="out_double_UnitDelay_Gain3_1"/>
      </output>
   </block>
   <block blocktype="Bias" name="out_double_UnitDelay_Bias">
      <input line="out_double_UnitDelay_Gain1_1" port="out_double_UnitDelay_Bias_1">
         <connect block="out_double_UnitDelay_Gain1" port="out_double_UnitDelay_Gain1_1"/>
      </input>
      <output line="out_double_UnitDelay_Bias_1" port="out_double_UnitDelay_Bias_1" usename="true">
         <connect block="out_double_UnitDelay_MathFunction" port="out_double_UnitDelay_MathFunction_1"/>
      </output>
   </block>
   <block blocktype="Gain" name="out_double_UnitDelay_Gain" rate="-1">
      <input line="out_double_UnitDelay_In1_1" port="out_double_UnitDelay_Gain_1">
         <connect block="out_double_UnitDelay_In1" port="out_double_UnitDelay_In1_1"/>
      </input>
      <output line="out_double_UnitDelay_Gain_1" port="out_double_UnitDelay_Gain_1" usename="true">
         <connect block="out_double_UnitDelay_Product" port="out_double_UnitDelay_Product_1"/>
      </output>
   </block>
   <block blocktype="Gain" name="out_double_UnitDelay_Gain1" rate="-1">
      <input line="out_double_UnitDelay_In1_1" port="out_double_UnitDelay_Gain1_1">
         <connect block="out_double_UnitDelay_In1" port="out_double_UnitDelay_In1_1"/>
      </input>
      <output line="out_double_UnitDelay_Gain1_1" port="out_double_UnitDelay_Gain1_1" usename="true">
         <connect block="out_double_UnitDelay_Bias" port="out_double_UnitDelay_Bias_1"/>
      </output>
   </block>
   <block blocktype="Gain" name="out_double_UnitDelay_Gain2" rate="-1">
      <input line="out_double_UnitDelay_UnitDelay_1" port="out_double_UnitDelay_Gain2_1">
         <connect block="out_double_UnitDelay_UnitDelay" port="out_double_UnitDelay_UnitDelay_1"/>
      </input>
      <output line="out_double_UnitDelay_Gain2_1" port="out_double_UnitDelay_Gain2_1" usename="true">
         <connect block="out_double_UnitDelay_Sum" port="out_double_UnitDelay_Sum_2"/>
      </output>
   </block>
   <block blocktype="Gain" name="out_double_UnitDelay_Gain3" rate="-1">
      <input line="out_double_UnitDelay_In1_1" port="out_double_UnitDelay_Gain3_1">
         <connect block="out_double_UnitDelay_In1" port="out_double_UnitDelay_In1_1"/>
      </input>
      <output line="out_double_UnitDelay_Gain3_1" port="out_double_UnitDelay_Gain3_1" usename="true">
         <connect block="out_double_UnitDelay_MathFunction1" port="out_double_UnitDelay_MathFunction1_1"/>
      </output>
   </block>
   <block blocktype="Math" name="out_double_UnitDelay_MathFunction" rate="-1">
      <input line="out_double_UnitDelay_Bias_1" port="out_double_UnitDelay_MathFunction_1">
         <connect block="out_double_UnitDelay_Bias" port="out_double_UnitDelay_Bias_1"/>
      </input>
      <output line="out_double_UnitDelay_MathFunction_1" port="out_double_UnitDelay_MathFunction_1" usename="true">
         <connect block="out_double_UnitDelay_Sum" port="out_double_UnitDelay_Sum_1"/>
      </output>
   </block>
   <block blocktype="Math" name="out_double_UnitDelay_MathFunction1" rate="-1">
      <input line="out_double_UnitDelay_Gain3_1" port="out_double_UnitDelay_MathFunction1_1">
         <connect block="out_double_UnitDelay_Gain3" port="out_double_UnitDelay_Gain3_1"/>
      </input>
      <output line="out_double_UnitDelay_MathFunction1_1" port="out_double_UnitDelay_MathFunction1_1" usename="true">
         <connect block="out_double_UnitDelay_Sum1" port="out_double_UnitDelay_Sum1_1"/>
      </output>
   </block>
   <block blocktype="Product" name="out_double_UnitDelay_Product" rate="-1">
      <input line="out_double_UnitDelay_Gain_1" port="out_double_UnitDelay_Product_1">
         <connect block="out_double_UnitDelay_Gain" port="out_double_UnitDelay_Gain_1"/>
      </input>
      <input line="out_double_UnitDelay_UnitDelay_1" port="out_double_UnitDelay_Product_2">
         <connect block="out_double_UnitDelay_UnitDelay" port="out_double_UnitDelay_UnitDelay_1"/>
      </input>
      <input line="out_double_UnitDelay_UnitDelay1_1" port="out_double_UnitDelay_Product_3">
         <connect block="out_double_UnitDelay_UnitDelay1" port="out_double_UnitDelay_UnitDelay1_1"/>
      </input>
      <output line="out_double_UnitDelay_Product_1" port="out_double_UnitDelay_Product_1" usename="true">
         <connect block="out_double_UnitDelay_Saturation" port="out_double_UnitDelay_Saturation_1"/>
      </output>
   </block>
   <block blocktype="Saturate" name="out_double_UnitDelay_Saturation" rate="-1">
      <input line="out_double_UnitDelay_Product_1" port="out_double_UnitDelay_Saturation_1">
         <connect block="out_double_UnitDelay_Product" port="out_double_UnitDelay_Product_1"/>
      </input>
      <output line="out_double_UnitDelay_Saturation_1" port="out_double_UnitDelay_Saturation_1" usename="true">
         <connect block="out_double_UnitDelay_Out1" port="out_double_UnitDelay_Out1_1"/>
      </output>
   </block>
   <block blocktype="Sum" name="out_double_UnitDelay_Sum" rate="-1">
      <input line="out_double_UnitDelay_MathFunction_1" port="out_double_UnitDelay_Sum_1">
         <connect block="out_double_UnitDelay_MathFunction" port="out_double_UnitDelay_MathFunction_1"/>
      </input>
      <input line="out_double_UnitDelay_Gain2_1" port="out_double_UnitDelay_Sum_2">
         <connect block="out_double_UnitDelay_Gain2" port="out_double_UnitDelay_Gain2_1"/>
      </input>
      <output line="out_double_UnitDelay_Sum_1" port="out_double_UnitDelay_Sum_1" usename="true">
         <connect block="out_double_UnitDelay_UnitDelay" port="out_double_UnitDelay_UnitDelay_1"/>
      </output>
   </block>
   <block blocktype="Sum" name="out_double_UnitDelay_Sum1" rate="-1">
      <input line="out_double_UnitDelay_MathFunction1_1" port="out_double_UnitDelay_Sum1_1">
         <connect block="out_double_UnitDelay_MathFunction1" port="out_double_UnitDelay_MathFunction1_1"/>
      </input>
      <input line="out_double_UnitDelay_UnitDelay1_1" port="out_double_UnitDelay_Sum1_2">
         <connect block="out_double_UnitDelay_UnitDelay1" port="out_double_UnitDelay_UnitDelay1_1"/>
      </input>
      <output line="out_double_UnitDelay_Sum1_1" port="out_double_UnitDelay_Sum1_1" usename="true">
         <connect block="out_double_UnitDelay_UnitDelay1" port="out_double_UnitDelay_UnitDelay1_1"/>
      </output>
   </block>
   <block blocktype="UnitDelay" name="out_double_UnitDelay_UnitDelay" rate="-1">
      <input line="out_double_UnitDelay_Sum_1" port="out_double_UnitDelay_UnitDelay_1">
         <connect block="out_double_UnitDelay_Sum" port="out_double_UnitDelay_Sum_1"/>
      </input>
      <output line="out_double_UnitDelay_UnitDelay_1" port="out_double_UnitDelay_UnitDelay_1" usename="true">
         <connect block="out_double_UnitDelay_Gain2" port="out_double_UnitDelay_Gain2_1"/>
         <connect block="out_double_UnitDelay_Product" port="out_double_UnitDelay_Product_2"/>
      </output>
   </block>
   <block blocktype="UnitDelay" name="out_double_UnitDelay_UnitDelay1" rate="-1">
      <input line="out_double_UnitDelay_Sum1_1" port="out_double_UnitDelay_UnitDelay1_1">
         <connect block="out_double_UnitDelay_Sum1" port="out_double_UnitDelay_Sum1_1"/>
      </input>
      <output line="out_double_UnitDelay_UnitDelay1_1" port="out_double_UnitDelay_UnitDelay1_1" usename="true">
         <connect block="out_double_UnitDelay_Product" port="out_double_UnitDelay_Product_3"/>
         <connect block="out_double_UnitDelay_Sum1" port="out_double_UnitDelay_Sum1_2"/>
      </output>
   </block>
   <block blocktype="Outport" name="out_double_UnitDelay_Out1" rate="-1">
      <input line="out_double_UnitDelay_Saturation_1" port="out_double_UnitDelay_Out1_1">
         <connect block="out_double_UnitDelay_Saturation" port="out_double_UnitDelay_Saturation_1"/>
      </input>
   </block>
</sm:blocks>