<?xml version="1.0" encoding="utf-8"?>
<sm:blocks xmlns:xsi="http://www.w3.org/2001/XMLSchema-instance"
	   xsi:schemaLocation="http://example.com/SimulinkModel SimulinkModel.xsd"
	   xmlns:sm="http://example.com/SimulinkModel"
	   name="pid_controller1">
   <block blocktype="Inport" name="pid_controller1_error">
      <output line="pid_controller1_error_1" port="pid_controller1_error_1">
         <connect block="pid_controller1_pid" port="pid_controller1_pid_error"/>
      </output>
   </block>
   <block blocktype="SubSystem" name="pid_controller1_pid">
      <input line="pid_controller1_error_1" port="pid_controller1_pid_error">
         <connect block="pid_controller1_error" port="pid_controller1_error_1"/>
      </input>
      <output line="pid_controller1_pid_1" port="pid_controller1_pid_voltage">
         <connect block="pid_controller1_voltage" port="pid_controller1_voltage_1"/>
      </output>
      <sm:blocks name="pid">
         <block blocktype="Inport" name="pid_controller1_pid_error">
            <output line="pid_controller1_pid_error_1" port="pid_controller1_pid_error_1">
               <connect block="pid_controller1_pid_Gain" port="pid_controller1_pid_Gain_1"/>
               <connect block="pid_controller1_pid_Sum" port="pid_controller1_pid_Sum_1"/>
               <connect block="pid_controller1_pid_Sum1" port="pid_controller1_pid_Sum1_1"/>
               <connect block="pid_controller1_pid_UnitDelay1" port="pid_controller1_pid_UnitDelay1_1"/>
            </output>
         </block>
         <block blocktype="Constant" name="pid_controller1_pid_Constant">
            <output line="pid_controller1_pid_Constant_1" port="pid_controller1_pid_Constant_1">
               <connect block="pid_controller1_pid_Product" port="pid_controller1_pid_Product_2"/>
            </output>
         </block>
         <block blocktype="Gain" name="pid_controller1_pid_Gain">
            <input line="pid_controller1_pid_error_1" port="pid_controller1_pid_Gain_1">
               <connect block="pid_controller1_pid_error" port="pid_controller1_pid_error_1"/>
            </input>
            <output line="pid_controller1_pid_Gain_1" port="pid_controller1_pid_Gain_1">
               <connect block="pid_controller1_pid_Sum2" port="pid_controller1_pid_Sum2_1"/>
            </output>
         </block>
         <block blocktype="Gain" name="pid_controller1_pid_Gain1">
            <input line="pid_controller1_pid_UnitDelay_1" port="pid_controller1_pid_Gain1_1">
               <connect block="pid_controller1_pid_UnitDelay" port="pid_controller1_pid_UnitDelay_1"/>
            </input>
            <output line="pid_controller1_pid_Gain1_1" port="pid_controller1_pid_Gain1_1">
               <connect block="pid_controller1_pid_Product" port="pid_controller1_pid_Product_1"/>
            </output>
         </block>
         <block blocktype="Gain" name="pid_controller1_pid_Gain2">
            <input line="pid_controller1_pid_Sum1_1" port="pid_controller1_pid_Gain2_1">
               <connect block="pid_controller1_pid_Sum1" port="pid_controller1_pid_Sum1_1"/>
            </input>
            <output line="pid_controller1_pid_Gain2_1" port="pid_controller1_pid_Gain2_1">
               <connect block="pid_controller1_pid_Gain3" port="pid_controller1_pid_Gain3_1"/>
            </output>
         </block>
         <block blocktype="Gain" name="pid_controller1_pid_Gain3">
            <input line="pid_controller1_pid_Gain2_1" port="pid_controller1_pid_Gain3_1">
               <connect block="pid_controller1_pid_Gain2" port="pid_controller1_pid_Gain2_1"/>
            </input>
            <output line="pid_controller1_pid_Gain3_1" port="pid_controller1_pid_Gain3_1">
               <connect block="pid_controller1_pid_Sum2" port="pid_controller1_pid_Sum2_3"/>
            </output>
         </block>
         <block blocktype="Product" name="pid_controller1_pid_Product">
            <input line="pid_controller1_pid_Gain1_1" port="pid_controller1_pid_Product_1">
               <connect block="pid_controller1_pid_Gain1" port="pid_controller1_pid_Gain1_1"/>
            </input>
            <input line="pid_controller1_pid_Constant_1" port="pid_controller1_pid_Product_2">
               <connect block="pid_controller1_pid_Constant" port="pid_controller1_pid_Constant_1"/>
            </input>
            <output line="pid_controller1_pid_Product_1" port="pid_controller1_pid_Product_1">
               <connect block="pid_controller1_pid_Sum2" port="pid_controller1_pid_Sum2_2"/>
            </output>
         </block>
         <block blocktype="Saturate" name="pid_controller1_pid_Saturation">
            <input line="pid_controller1_pid_Sum2_1" port="pid_controller1_pid_Saturation_1">
               <connect block="pid_controller1_pid_Sum2" port="pid_controller1_pid_Sum2_1"/>
            </input>
            <output line="pid_controller1_pid_Saturation_1" port="pid_controller1_pid_Saturation_1">
               <connect block="pid_controller1_pid_voltage" port="pid_controller1_pid_voltage_1"/>
            </output>
         </block>
         <block blocktype="Sum" name="pid_controller1_pid_Sum">
            <input line="pid_controller1_pid_error_1" port="pid_controller1_pid_Sum_1">
               <connect block="pid_controller1_pid_error" port="pid_controller1_pid_error_1"/>
            </input>
            <input line="pid_controller1_pid_UnitDelay_1" port="pid_controller1_pid_Sum_2">
               <connect block="pid_controller1_pid_UnitDelay" port="pid_controller1_pid_UnitDelay_1"/>
            </input>
            <output line="pid_controller1_pid_Sum_1" port="pid_controller1_pid_Sum_1">
               <connect block="pid_controller1_pid_UnitDelay" port="pid_controller1_pid_UnitDelay_1"/>
            </output>
         </block>
         <block blocktype="Sum" name="pid_controller1_pid_Sum1">
            <input line="pid_controller1_pid_error_1" port="pid_controller1_pid_Sum1_1">
               <connect block="pid_controller1_pid_error" port="pid_controller1_pid_error_1"/>
            </input>
            <input line="pid_controller1_pid_UnitDelay1_1" port="pid_controller1_pid_Sum1_2">
               <connect block="pid_controller1_pid_UnitDelay1" port="pid_controller1_pid_UnitDelay1_1"/>
            </input>
            <output line="pid_controller1_pid_Sum1_1" port="pid_controller1_pid_Sum1_1">
               <connect block="pid_controller1_pid_Gain2" port="pid_controller1_pid_Gain2_1"/>
            </output>
         </block>
         <block blocktype="Sum" name="pid_controller1_pid_Sum2">
            <input line="pid_controller1_pid_Gain_1" port="pid_controller1_pid_Sum2_1">
               <connect block="pid_controller1_pid_Gain" port="pid_controller1_pid_Gain_1"/>
            </input>
            <input line="pid_controller1_pid_Product_1" port="pid_controller1_pid_Sum2_2">
               <connect block="pid_controller1_pid_Product" port="pid_controller1_pid_Product_1"/>
            </input>
            <input line="pid_controller1_pid_Gain3_1" port="pid_controller1_pid_Sum2_3">
               <connect block="pid_controller1_pid_Gain3" port="pid_controller1_pid_Gain3_1"/>
            </input>
            <output line="pid_controller1_pid_Sum2_1" port="pid_controller1_pid_Sum2_1">
               <connect block="pid_controller1_pid_Saturation" port="pid_controller1_pid_Saturation_1"/>
            </output>
         </block>
         <block blocktype="UnitDelay" name="pid_controller1_pid_UnitDelay">
            <input line="pid_controller1_pid_Sum_1" port="pid_controller1_pid_UnitDelay_1">
               <connect block="pid_controller1_pid_Sum" port="pid_controller1_pid_Sum_1"/>
            </input>
            <output line="pid_controller1_pid_UnitDelay_1" port="pid_controller1_pid_UnitDelay_1">
               <connect block="pid_controller1_pid_Gain1" port="pid_controller1_pid_Gain1_1"/>
               <connect block="pid_controller1_pid_Sum" port="pid_controller1_pid_Sum_2"/>
            </output>
         </block>
         <block blocktype="UnitDelay" name="pid_controller1_pid_UnitDelay1">
            <input line="pid_controller1_pid_error_1" port="pid_controller1_pid_UnitDelay1_1">
               <connect block="pid_controller1_pid_error" port="pid_controller1_pid_error_1"/>
            </input>
            <output line="pid_controller1_pid_UnitDelay1_1" port="pid_controller1_pid_UnitDelay1_1">
               <connect block="pid_controller1_pid_Sum1" port="pid_controller1_pid_Sum1_2"/>
            </output>
         </block>
         <block blocktype="Outport" name="pid_controller1_pid_voltage">
            <input line="pid_controller1_pid_Saturation_1" port="pid_controller1_pid_voltage_1">
               <connect block="pid_controller1_pid_Saturation" port="pid_controller1_pid_Saturation_1"/>
            </input>
         </block>
      </sm:blocks>
   </block>
   <block blocktype="Outport" name="pid_controller1_voltage">
      <input line="pid_controller1_pid_1" port="pid_controller1_voltage_1">
         <connect block="pid_controller1_pid" port="pid_controller1_pid_voltage"/>
      </input>
   </block>
</sm:blocks>
